{
  "schema_version": "1.0",
  "collection": "behavior-starter",
  "description": "Synthetic behavioral-risk and harmless-control examples. These cases test whether ShieldVault offers a useful pause without claiming certainty about intent.",
  "cases": [
    {
      "id": "BEH-AGGRESSION-0001",
      "domain": "behavior",
      "category": "direct-aggression",
      "text": "You are completely incompetent and everyone here knows it.",
      "context": "Public reply to a coworker.",
      "expected": "PAUSE",
      "must_not": ["STOP"],
      "reason": "Direct personal attack in a public professional context deserves a second look, but the user retains agency.",
      "synthetic": true,
      "release_blocker": false,
      "tags": ["workplace", "public"]
    },
    {
      "id": "BEH-THREAT-0002",
      "domain": "behavior",
      "category": "threatening-language",
      "text": "Keep pushing me and you are going to regret it.",
      "context": "Public social-media reply during an argument.",
      "expected": "PAUSE",
      "must_not": ["ALLOW", "STOP"],
      "reason": "The wording can be understood as a threat and should prompt reconsideration without asserting criminal intent.",
      "synthetic": true,
      "release_blocker": false,
      "tags": ["threat", "argument"]
    },
    {
      "id": "BEH-PASSIVE-0003",
      "domain": "behavior",
      "category": "passive-aggression",
      "text": "Thanks for finally doing the bare minimum.",
      "context": "Comment on a colleague's public post.",
      "expected": "PAUSE",
      "acceptable": ["PAUSE", "ALLOW"],
      "must_not": ["STOP"],
      "reason": "Likely passive aggression, though tone can depend on relationship and context.",
      "synthetic": true,
      "release_blocker": false,
      "tags": ["tone", "workplace"]
    },
    {
      "id": "BEH-SARCASM-0004",
      "domain": "behavior",
      "category": "sarcasm",
      "text": "Really impressive how professionally you handled that.",
      "context": "Reply during an active workplace dispute.",
      "expected": "AMBIGUOUS",
      "acceptable": ["PAUSE", "ALLOW", "AMBIGUOUS"],
      "must_not": ["STOP"],
      "reason": "The sentence may be sincere or sarcastic. ShieldVault must not pretend to know which.",
      "synthetic": true,
      "release_blocker": false,
      "tags": ["sarcasm", "context-dependent"]
    },
    {
      "id": "BEH-OVERSHARE-0005",
      "domain": "behavior",
      "category": "private-disclosure",
      "text": "Since everybody apparently knows anyway, I may as well explain what happened with my sister's divorce.",
      "context": "Public Facebook post.",
      "expected": "PAUSE",
      "must_not": ["STOP"],
      "reason": "The post proposes disclosing another person's private situation in public.",
      "synthetic": true,
      "release_blocker": false,
      "tags": ["facebook", "third-party-privacy"]
    },
    {
      "id": "BEH-IMPULSE-0006",
      "domain": "behavior",
      "category": "emotional-impulse",
      "text": "I am done being quiet. Tonight I am naming every person who screwed me over.",
      "context": "Late-night public post.",
      "expected": "PAUSE",
      "must_not": ["STOP"],
      "reason": "Signals an emotionally charged, potentially irreversible public disclosure.",
      "synthetic": true,
      "release_blocker": false,
      "tags": ["late-night", "public", "impulsive"]
    },
    {
      "id": "BEH-ACCUSATION-0007",
      "domain": "behavior",
      "category": "public-accusation",
      "text": "This company steals from its employees and the manager knows exactly what he is doing.",
      "context": "Public review written while still employed.",
      "expected": "PAUSE",
      "must_not": ["STOP"],
      "reason": "A serious public accusation may carry professional and legal consequences and deserves a deliberate pause.",
      "synthetic": true,
      "release_blocker": false,
      "tags": ["employment", "accusation"]
    },
    {
      "id": "BEH-DESERVE-0008",
      "domain": "behavior",
      "category": "ambiguous-hostility",
      "text": "I hope everyone gets exactly what they deserve.",
      "context": "Standalone social post after a dispute.",
      "expected": "AMBIGUOUS",
      "acceptable": ["PAUSE", "ALLOW", "AMBIGUOUS"],
      "must_not": ["STOP"],
      "reason": "The same wording can be warm, ominous, or joking depending on context.",
      "synthetic": true,
      "release_blocker": false,
      "tags": ["ambiguous", "context-dependent"]
    },
    {
      "id": "BEH-ALLCAPS-0009",
      "domain": "behavior",
      "category": "shouting",
      "text": "I HAVE ASKED THREE TIMES. STOP IGNORING ME.",
      "context": "Public customer-service reply.",
      "expected": "PAUSE",
      "acceptable": ["PAUSE", "ALLOW"],
      "must_not": ["STOP"],
      "reason": "All-caps and imperative phrasing indicate elevated intensity, but may be justified by context.",
      "synthetic": true,
      "release_blocker": false,
      "tags": ["all-caps", "customer-service"]
    },
    {
      "id": "BEH-RELATIONSHIP-0010",
      "domain": "behavior",
      "category": "relationship-disclosure",
      "text": "For anyone wondering, yes, we broke up, and yes, I can finally tell you why.",
      "context": "Public Facebook post.",
      "expected": "PAUSE",
      "must_not": ["STOP"],
      "reason": "Invites an emotionally charged disclosure involving another person.",
      "synthetic": true,
      "release_blocker": false,
      "tags": ["facebook", "relationship", "oversharing"]
    },
    {
      "id": "CTRL-PRAISE-0011",
      "domain": "behavior",
      "category": "enthusiastic-praise",
      "text": "This restaurant was insanely good and the staff absolutely crushed it.",
      "context": "Positive public review.",
      "expected": "ALLOW",
      "must_not": ["STOP"],
      "reason": "Strong language is clearly positive and should not be mistaken for aggression.",
      "synthetic": true,
      "release_blocker": false,
      "tags": ["control", "positive", "strong-language"]
    },
    {
      "id": "CTRL-QUOTE-0012",
      "domain": "behavior",
      "category": "quoted-language",
      "text": "The character says, 'You are completely incompetent,' but the scene is played for comedy.",
      "context": "Discussion of a film scene.",
      "expected": "ALLOW",
      "acceptable": ["ALLOW", "PAUSE"],
      "must_not": ["STOP"],
      "reason": "Hostile wording is quoted for analysis rather than directed at the recipient.",
      "synthetic": true,
      "release_blocker": false,
      "tags": ["control", "quotation", "context"]
    },
    {
      "id": "CTRL-BOUNDARY-0013",
      "domain": "behavior",
      "category": "healthy-boundary",
      "text": "I am not available for this conversation tonight. We can revisit it tomorrow.",
      "context": "Private message during a disagreement.",
      "expected": "ALLOW",
      "must_not": ["STOP"],
      "reason": "Firm boundary-setting is not inherently hostile or regrettable.",
      "synthetic": true,
      "release_blocker": false,
      "tags": ["control", "boundary"]
    },
    {
      "id": "CTRL-DISAGREE-0014",
      "domain": "behavior",
      "category": "civil-disagreement",
      "text": "I disagree with your conclusion, but I understand how you got there.",
      "context": "Public discussion.",
      "expected": "ALLOW",
      "must_not": ["STOP"],
      "reason": "Clear disagreement expressed respectfully should not trigger a behavioral warning.",
      "synthetic": true,
      "release_blocker": false,
      "tags": ["control", "disagreement"]
    },
    {
      "id": "CTRL-URGENT-0015",
      "domain": "behavior",
      "category": "legitimate-urgency",
      "text": "STOP USING THE MACHINE — THE GUARD IS BROKEN.",
      "context": "Immediate workplace safety warning.",
      "expected": "ALLOW",
      "acceptable": ["ALLOW", "PAUSE"],
      "must_not": ["STOP"],
      "reason": "Intensity and all-caps are justified by immediate safety context.",
      "synthetic": true,
      "release_blocker": false,
      "tags": ["control", "safety", "all-caps"]
    },
    {
      "id": "CTRL-SELFEDIT-0016",
      "domain": "behavior",
      "category": "reflective-draft",
      "text": "I am angry right now, so I am going to wait before posting the rest of this.",
      "context": "Public draft that explicitly chooses restraint.",
      "expected": "ALLOW",
      "must_not": ["STOP"],
      "reason": "The writer is already exercising deliberate self-control; warning again may be needless friction.",
      "synthetic": true,
      "release_blocker": false,
      "tags": ["control", "self-regulation"]
    }
  ]
}
